Job Title,Company Name,Rating,Job Description,size,founded,type,industry,sector,revenue,salary,job_state,python,java,javascript,sql,excel,spark,aws,azure,job_simp,seniority,desc_len
"Front End Engineer, MADS- Measurement and Data Science",Amazon.com Services LLC,3.8,"Professional non-internship experience with front end, web or mobile software development using JavaScript, HTML and CSS
Job summary
Front End Engineer- AMC

About the role

We are looking for an engineer who is excited about solving challenging engineering problems, has a proven track record of building web applications and has the ability to support highly available systems. In this role you will partner with product leaders and business partners to design, implement and launch new features that enable advertisers to build, manage and serve innovative ads that speak to their customers. The right candidate will possess strong technical skills, can dive deep with demonstrated experience in leading projects and is able to mentor junior team members. There is lots of opportunity for growth in this role as the team is expanding and needs engineers who are motivated to constantly improve technical strategy, operational efforts and development life cycle.

Enjoy innovating on behalf of customers, simplifying complex problems and tackling tough design challenges? Come be part of this energetic, bright, and fun-loving team!

The pay range for this position in Colorado is $93,800/yr; however, base pay offered may vary depending on job-related knowledge, skills, and experience. A sign-on bonus and restricted stock units may be provided as part of the compensation package, in addition to a full range of medical, financial, and/or other benefits, dependent on the position offered. This information is provided per the Colorado Equal Pay Act. Base pay information is based on market location. Applicants should apply via Amazon’s internal or external careers site.

#sspajobs

Amazon is committed to a diverse and inclusive workplace. Amazon is an equal opportunity employer and does not discriminate on the basis of race, national origin, gender, gender identity, sexual orientation, protected veteran status, disability, age, or other legally protected status. For individuals with disabilities who would like to request an accommodation, please visit https://www.amazon.jobs/en/disability/us.",10000+ Employees,1994,Company - Public,Internet & Web Services,Information Technology,$10+ billion (USD),93800,CO,0,1,1,0,0,0,0,0,na,na,2108
Jr. Data Scientist,Net2Aspire LLC,-1.0," Apply Statistical and Machine Learning methods to specific business problems and data.
 Ensure data quality throughout all stages of acquisition and processing, including such areas as data sourcing/collection, ground truth generation, normalization, transformation, cross-lingual alignment/mapping, etc.
 Using tools such as Tableau, Looker and GoogleData Studio to aggregate data from across our software tools to build and develop dashboards for both client-facing and internal purposes across the company that feature relevant KPIs and metrics
 Create data dashboards and other data visualization tools to track progress to inform continuous quality improvement of the Congregate Settings Investigation and Response Unit.
 Design, develop, evaluate, and release highly innovative models elevate the customer experience and track impact over time",-1,-1,-1,-1,-1,-1,82500,Remote,0,0,0,0,0,0,0,0,data scientist,jr,855
Healthcare Data Scientist,Humbi Health LLC,-1.0,"Humbi Health is looking for highly analytical individuals who are skilled in utilizing various data analytical tools to manipulate data and derive meaningful business insights for client consumption.
Our clients are health plans, drug manufacturers and healthcare providers (physician practices, hospitals and population health management organizations).
The duties of this position include: organizing and managing large and varied data sets, analyzing healthcare data to optimize business operations and communicating the findings through dissemination of data visualization exhibits and tabular reports.
Healthcare Data Analyst Responsibilities:
· Compiling and organizing healthcare data.
· Analyzing data to assist in delivering optimal healthcare management and decision making.
· Using healthcare data to achieve administrative needs and goals.
· Investigating data to find patterns and trends.
· Understanding healthcare business operations.
· Utilizing different data sources for analyses.
· Converting data into usable information that is easy to understand.
· Developing reports and presentations.
· Communicating analytic insights to management.",-1,-1,-1,-1,-1,-1,175000,Remote,0,0,0,0,0,0,0,0,data scientist,na,1157
"CO-OP, DATA SCIENCE",PUMA,4.0,"INTERNS
CO-OP, DATA SCIENCE
Somerville, Massachusetts, United States of America

SPEED & SPIRIT is what we look for in our candidates, defined by some simple values that inspire us to BE DRIVEN in our performance, BE VIBRANT in our sporting legacy, BE TOGETHER in our team spirit, and BE YOU to let our individual talent and experience shine. Applying for a job at PUMA is easy and all genders are welcome. Simply click APPLY ONLINE and follow the steps to upload your application.
YOUR MISSION",10000+ Employees,1948,Company - Private,"Department, Clothing & Shoe Stores",Retail & Wholesale,$5 to $10 million (USD),105886,MA,0,0,0,0,0,0,0,0,na,na,494
Data Science Contractor,Rhythm Energy Inc,3.4,"Data Science Contracting Opportunities
About Rhythm:
Rhythm is a renewable energy and technology company empowering you to take control of your budget and your carbon footprint. We combine energy market expertise with technology, design, and data science to create best-in-class products and services that are simple, delightful, and seamlessly integrated within the rhythm of your life. Our mission is to upend the energy status quo by setting a new standard of service excellence and customer partnership. We are a mission-driven, results-oriented group of engineers, businesspeople, designers, and artists who love solving tough problems, all while making a positive impact on our communities.
Our team has a variety of Data Science project opportunities for independent contractors. Depending on your skills and experience, we need help with projects such as:",1 to 50 Employees,Unknown,Unknown / Non-Applicable,-1,-1,-1,105886,Remote,0,0,0,0,1,0,0,0,na,na,863
Data Scientist 1,The Coca-Cola Company,4.0,"About Enterprise Data and Analytics:
The Data and Analytics (DnA) Services organization is transforming how Coca-Cola leverages data across the entire company. We passionately develop and scale leading data capabilities for Coca-Cola, driving growth and delighting consumers through innovation and agile, insight-led decision making.
Job Description Summary:
You will play a critical role in the growing Data Science Services team in DnA, where you will be responsible for developing advanced analytics and machine learning models across domains including: marketing, supply chain optimization, forecasting, digital transformation, and food and beverage science. You will work closely with IT partners, process owners and business stakeholders to deliver impactful data science solutions at significant scale. You will have the opportunity to do your best work every day and deliver disruptive innovation by tapping into new datasets, leveraging the latest cloud technologies, and being supported by a robust analytics and IT organization.
Data Science; Microsoft Office; Communication; Microsoft Azure Databricks; Digital Transformation; Computer Vision; Azure Machine Learning Studio; Artificial Intelligence Technologies; Cloud Platform; Deep Learning; Agile Methodologies; Machine Learning",10000+ Employees,1886,Company - Public,Food & Beverage Manufacturing,Manufacturing,$10+ billion (USD),88155,GA,0,0,0,0,0,0,0,1,data scientist,na,1293
Data Science Fellow,Learning Ally,3.6,"Data Science Fellow
Learning Ally is a leading nonprofit education solutions organization that transforms the lives of struggling learners by delivering proven literacy solutions that help students reach their potential. Our mission is to radically change education, transforming the lives of children by providing reading interventions and solutions to help them succeed academically, build self-confidence, and thrive in school and beyond. In the US, 65% of fourth graders read below proficiency and are 400% more likely to drop-out of high school. For most “at risk” students (students of color, low income, English Language Learners and students with learning disabilities) the problem is even more acute.
Learning Ally seeks to break this cycle. With early student assessment, intervention and accommodation and professional development for educators, Learning Ally can identify and prevent learning issues by working with schools and educators to support new and struggling readers. Our solutions build a strong foundation for independent, engaged learners who are empowered to achieve socially, emotionally, and academically, regardless of background or learning difference.",201 to 500 Employees,1948,Nonprofit Organization,Primary & Secondary Schools,Education,$10 to $25 million (USD),88155,Remote,0,0,0,0,0,0,0,0,na,na,1181
Data Science Associate (Remote),pulseData,5.0,"pulseData is changing the way healthcare data is utilized within major healthcare sectors. As a series A health-tech startup, we provide the insights necessary for medical staff to understand who has and is at risk of major chronic illnesses. We have rooted ourselves within the Kidney space, and have the capabilities of bringing our approach to many more patient populations given our capabilities.

We recently raised $16.5M in our series A and are growing fast. This means we are onboarding brilliant people and providing endless areas for our employees to grow their careers. We believe in trust and transparency, and enjoy a remote friendly working environment that promotes collaboration and diversity.
The Role:
In your role as a Data Science Associate, you will use machine learning to deliver insightful and actionable intelligence and predictive solutions to our team to improve Healthcare growth in our business. You will gain experience understanding healthcare and developing data driven solutions to improve care delivery, while working closely with other team members of our Data Science and engineering team to deliver value to our business partners. Aside from supporting our data science model creation and data teams, you'll also assist the product team with growth opportunities.",1 to 50 Employees,2015,Company - Private,Health Care Services & Hospitals,Healthcare,Unknown / Non-Applicable,49680,NY,0,0,0,0,0,0,0,0,na,na,1300
Data Analyst,SunPower,3.9,"Do you want to change the world? We do, too.
Solar penetration is less than 1%, but just one hour of sunlight, if harnessed, could power the entire world for a year. We have the opportunity to change the way energy is produced, distributed and consumed, and we’re looking for talented, committed people to help us drive our growth and achieve our goals.

SunPower is a solar energy solutions company with a rich heritage of pioneering the best solar technologies in the world. Our solutions are unrivaled in terms of long-term reliability, efficiency, and performance. SunPower offers the only solar + storage solution designed and warranted by one company that gives customers control over electricity consumption. Through design, installation, maintenance, and monitoring, SunPower provides its world-class solar solutions to residential and commercial customers across the U.S.

SunPower is changing the way our world is powered every day with a brilliant, passionate, and driven team of more than 2,500 in North America and the Philippines. In an industry that is reshaping the world’s energy future, there’s no better place to be than SunPower.

We believe that our employees create our brand – with each project, each communication, each task completed and each interaction. SunPower welcomes the forward thinkers, the future savers of the world, the freedom chasers and all those demanding better, cleaner energy.",5001 to 10000 Employees,1985,Company - Public,Energy & Utilities,"Energy, Mining & Utilities",$2 to $5 billion (USD),49680,Remote,0,0,0,0,0,0,0,0,analyst,na,1420
Data Science I (Remote),MediaMath,3.1,"This job can be performed remotely from anywhere in the US.
MediaMath's strength is in numbers. Our technology analyzes 200 billion customer opportunities daily– more volume than the top 10 stock exchanges in the world, combined. Over 700 Mathletes in 16 global offices are trusted by two-thirds of the Fortune 500 and partner with thousands of marketers to ensure brands connect with right audiences, in the right place, in the right time.
We believe consumers want to have meaningful conversations with their favorite and yet-to-be-discovered brands across all digital touchpoints. Our omnichannel, integrated programmatic platform unites digital media and big data to maximize the return on every marketing dollar spent by making advertising relevant, personalized, measurable and controllable.
From inventing the DSP category in 2007 to being named a DMP Forrester Challenger (our first year participating in the DMP Wave!) in 2017, we continue to deliver results for marketers more quickly and accurately than any other solution.

Technology is changing the way brands interact with consumers. MediaMath is powering that change. Come be a part of it!",501 to 1000 Employees,2007,Company - Private,Publishing,Media & Communication,$100 to $500 million (USD),102479,NY,0,0,0,0,0,0,0,0,na,na,1155
"Data Science, Product Analytics",Microsoft,4.4,"Are you a Data Scientist with a passion for collaborating with Engineers, Product Managers, and other Data Scientists?

We’re looking for someone to join our team of Data Scientists and Technical Program Managers who are focused on driving product growth for the Developer Division. Your efforts will help the organization get more information and insights out of the data produced by our products and experiences.

We expect that you have experience or are interested in doing deep analysis to help us improve our products and experiences for developers. This includes customer journey analysis and statistical modeling to identify factors that are correlated with successful or adverse user outcomes.

You will be working on growing products made in our Developer Division that are used by millions of developers worldwide. According to the 2021 Stack Overflow developer survey, Visual Studio and Visual Studio Code are the leading IDEs used by developers, used by more than 30% and 70% respectively. Our Azure cloud platform is used by more than 30% of developers, with .NET as the most loved framework. We’re constantly striving to learn the needs of developers, how they work and what frustrates them, and how we can help them be more productive. Delighting and retaining developers who use Azure with our tools and services is our core mission.",10000+ Employees,1975,Company - Public,Computer Hardware Development,Information Technology,$10+ billion (USD),124486,WA,0,0,0,0,0,0,0,1,na,na,1350
Data Analytics Developer - 100% Remote,Stryker,4.2,"Why join Stryker?
We are proud to be named one of the World’s Best Workplaces and a Best Workplace for Diversity by Fortune Magazine! Learn more about our award-winning organization by visiting stryker.com
Our benefits include bonuses; commissions; healthcare; insurance benefits; retirement programs; stock based plans; paid time off plans; family and parenting leaves; tuition reimbursement; wellness programs; onsite fitness centers and cafeterias; discount purchase programs; and service and performance awards – not to mention various social and recreational activities.

Who We Want:
Data managers. People who enjoy compiling, organizing, and consolidating large volumes of data and reports.",10000+ Employees,1941,Company - Public,Health Care Products Manufacturing,Manufacturing,$10+ billion (USD),127300,IL,0,0,0,0,0,0,0,0,na,na,697
Data Scientist - Development Program,National Security Agency,3.5,"NSA Overview: The professionals at the National Security Agency (NSA) have one common goal: to protect our nation. The mission requires a strong offense and a steadfast defense. The offense collects, processes, and disseminates intelligence information derived from foreign signals for intelligence and counterintelligence purposes. The defense prevents adversaries from gaining access to sensitive classified national security information. At NSA, Data Science is a fundamental discipline and is present in nearly every aspect of the mission. NSA is the nation's leader in providing foreign signals intelligence while also protecting U.S. government information systems, forging the frontier of communications, and data analysis. We serve the American people by applying technical skills to meaningful work, keeping our friends and families safe for generations to come. You will make a lasting impact serving your country as a Data Scientist at the National Security Agency, using your curiosity and technical expertise to analyze large data sets to inform decision-making against foreign threats. Description of Position: Data science at NSA is a multi-disciplinary field that uses elements of mathematics, statistics, computer science, and application-specific knowledge to gather, make, and communicate principled conclusions from data. Data science is present in every aspect of the mission. NSA Data Scientists tackle challenging real-world problems leveraging big data, high-performance computing, machine learning, and a breadth of other methodologies. We are looking for critical thinkers, problem solvers, and motivated individuals who are enthusiastic about data and believe that answers to hard questions lie in the yet-to-be-told story of diverse, complicated data sets. You will employ your mathematical science, computer science, and quantitative analysis skills to develop solutions to complex data problems and take full advantage of NSA's capabilities to tackle the highest priority foreign intelligence and cybsersecurity challenges. The Data Science Development Program (DSDP) is a three-year opportunity to develop and enhance your data science skills for an NSA career. Participants experience the breadth of data science at NSA through six- to nine-month assignments in a variety of diverse organizations, and collaborate with NSA's experts in the field of data science. You will have opportunities to attend technical conferences with experts from industry and academia. You will routinely discuss and share NSA's challenges and successes at weekly technical roundtables. You will study data science and related subjects in NSA-taught classes. We foster an environment where you will develop your data science skills, allowing you to quickly contribute to NSA's highest priority mission challenges. Graduates of the DSDP may choose their first permanent assignments from any of the NSA Directorates, depending on availability.
As a Data Scientist at NSA, your responsibilities may include: - Exploratory data analysis and exploratory model-fitting to reveal data features of interest - Machine-learned predictive modeling - Collecting and combining data from multiple sources - Identifying and analyzing anomalous data (including metadata) - Applying scientific methods to data evaluation, performing statistical inference, and data mining - Developing conceptual design and models to address mission requirements - Developing qualitative and quantitative methods for characterizing datasets in various states. - Performing analytic modeling, scripting, and/or programming - Working collaboratively and iteratively throughout the data-science lifecycle - Developing analytic plans, engineer supporting algorithms, and design and implement solutions which execute analytic plans. - Designing and developing analytics and techniques for analysis - Analyzing data using mathematical and statistical methods - Evaluating, documenting, and communicating research processes, analyses, and results to customers, peers, and leadership - Creating interpretable visualizations",Unknown,Government,National Agencies,Government & Public Administration,Unknown / Non-Applicable,-1,83872,MD,0,0,0,0,0,0,0,0,data scientist,na,4091
CS304 Introduction to Data Science,Park University Adjuncts,3.7,"Appointments are made on a term-by-term basis. Adjunct faculty are required to successfully complete an online Canvas LMS orientation course before being scheduled, as well as other training if required by the department. Online instructors must have evidence of successful teaching experience at an accredited college or university before they will be considered as an Online instructor. To teach undergraduate level courses applicants must hold a master’s degree in the discipline in which you wish to teach.

Click on Park University Locations for more information on our campus centers.
Click on Park University’s Catalog for more information on programs and courses.

The Computer Science department prefers you address their Core Learning Outcome’s with your submitted course justification.

Minimum Qualifications
Masters or Ph.D. level degree in the discipline (CS or IS) or in a related discipline (MBA, etc.) from an accredited school AND received graduate credit with a grade of B or better in the course applied to teach, OR one year work experience outside the classroom in a data science field involving coding and statistics.

Course Description
This course introduces the terminology and scientific techniques of data science, including all steps of the data science pipeline. It uses programming, statistics, and specialized tools to process large, real-world data sets, demonstrating the results in visually meaningful ways",1001 to 5000 Employees,2001,College / University,Colleges & Universities,Education,$50 to $100 million (USD),83872,Remote,0,0,0,0,0,0,0,0,na,na,1441
Junior Developer - AI/Data Scientist,"Hindsait, Inc.",-1.0,"Company Introduction
Hindsait Inc. is a leading Artificial Intelligence company with a mission to eliminate unnecessary health services, errors and biases by harnessing the power of machine intelligence. Hindsait’s AI SaaS platform has proven results of 4+ years of pioneering AI experience in healthcare, working with the finest Fortune 1000 clients, across the USA.
To support our growing business, we are looking for an ambitious Software Developer and Data Scientist, with an analytical bend of mind and a fast learner to join our team.
Hindsait is headquartered in New Jersey with its development center in Amherst, MA.
Job Description",-1,-1,-1,-1,-1,-1,62500,Remote,0,0,0,0,0,0,0,0,data scientist,jr,640
Data Scientist,Stitch Fix,3.2,"We’re a team of bright, kind individuals who are motivated by challenge and who care deeply about achieving great things. We know our individual strengths, but believe we only win as a team. We’re transforming the way people find what they love - and we need your big ideas. We just might be the perfect fit.
ABOUT THE TEAM
At Stitch Fix, our data science team combines machine learning with expert human judgment to generate innovative recommendations and insights that transform the way our clients discover what they love. We believe in a curiosity-driven data science culture where members are empowered to deliver impact through end-to-end model development. The diversity of the problems that we work on and the data-rich environment of our business make it possible, even essential, to bring the tools of multiple disciplines to bear on our hardest problems. As a $2B+ company, our growing business is looking for data scientists to join us in the revolutionization of retail.
ABOUT THE ROLE
This is a full-stack data scientist role where you will get to work closely with stakeholders to identify impactful problems and build algorithmic solutions. Cross-functional collaboration is deeply meaningful to us and is how we’ve built up immense trust with our partners in Strategy, Product, Merchandising, Styling, Marketing, Engineering, Finance and Operations. You'll have the opportunity to bring your ideas to life by building on a foundation of strong business support, clear vision, engaged internal users, and bright, kind teammates.",10000+ Employees,2011,Company - Public,Other Retail Stores,Retail & Wholesale,$2 to $5 billion (USD),62500,Remote,0,0,0,0,0,0,0,0,data scientist,na,1544
Data Science & Analytics,Digital Trike,5.0,"As much as you’re a master at rigorous mining, culling and interpretation of big data, you’re equally at task to glean small but meaningful data insights and making it pop in multiple data visualization platforms.",1 to 50 Employees,Company - Private,Information Technology Support Services,Information Technology,Unknown / Non-Applicable,-1,80767,UT,0,0,0,0,0,0,0,0,na,na,213
