Job Title,Company Name,Rating,Job Description,size,founded,type,industry,sector,revenue,salary,job_state,python,java,javascript,sql,excel,spark,aws,azure,job_simp,seniority,desc_len
Data Science Associate (Remote),pulseData,5.0,"pulseData is changing the way healthcare data is utilized within major healthcare sectors. As a series A health-tech startup, we provide the insights necessary for medical staff to understand who has and is at risk of major chronic illnesses. We have rooted ourselves within the Kidney space, and have the capabilities of bringing our approach to many more patient populations given our capabilities.

We recently raised $16.5M in our series A and are growing fast. This means we are onboarding brilliant people and providing endless areas for our employees to grow their careers. We believe in trust and transparency, and enjoy a remote friendly working environment that promotes collaboration and diversity.
The Role:
In your role as a Data Science Associate, you will use machine learning to deliver insightful and actionable intelligence and predictive solutions to our team to improve Healthcare growth in our business. You will gain experience understanding healthcare and developing data driven solutions to improve care delivery, while working closely with other team members of our Data Science and engineering team to deliver value to our business partners. Aside from supporting our data science model creation and data teams, you'll also assist the product team with growth opportunities.",1 to 50 Employees,2015,Company - Private,Health Care Services & Hospitals,Healthcare,Unknown / Non-Applicable,49680,NY,0,0,0,0,0,0,0,0,na,na,1300
Data Science Associate,VentureWell,3.8,"Join a growing team of data professionals who are committed to using data science for good. As a Data Science Associate at VentureWell, you will play a key role in data collection and outcomes tracking to help mission driven leaders visualize their impact in addressing the world's most intractable challenges related to entrepreneurship and innovation in technology and sciences. We are looking for a colleague who is energized by supporting our data stewardship and management efforts enabling our organization to use data for decision making.
To be successful in this role you must enjoy working collaboratively, thinking strategically and creatively, and have the ability to make clear connections between your work and equity and justice in the implementation of our programs. You also enjoy tracking metrics, stewarding data, and continuing to stay abreast of the latest in data science. This role is an integral part of a team that prioritizes learning and experimentation, along with opportunities to evolve and grow into a specialization of interest. Our new Data Science Associate will report to our Director of Data Systems.",1 to 50 Employees,Company - Public,Civic & Social Services,Nonprofit & NGO,$5 to $10 million (USD),-1,73397,MA,0,0,0,0,0,0,0,0,na,na,1135
Data Science Trainee,Axle Informatics,3.0,"Overview:
Axle Informatics is a bioinformatics and information technology company that offers innovative computer services, informatics, and enterprise solutions to research centers and healthcare organizations around the globe. With experts in software engineering, bioinformatics and program management, we focus on developing and applying technology tools and techniques to empower decision-making and accelerate the discovery in translational research. We work with some of the top research organizations and facilities in the country including multiple institutes at the National Institutes of health (NIH).

Overview
Axle is seeking a highly ambitious, adaptable, structured, and detail oriented Data Science Trainee to join our vibrant team.

Responsibilities",1 to 50 Employees,2004,Company - Private,Computer Hardware Development,Information Technology,Less than $1 million (USD),87202,MD,0,0,0,0,0,0,0,0,na,na,766
STATISTICAL ASSISTANT,UTOFUN,4.1,"Overview
The UTOFUN is the leading internet source of analysis on Economy & US Real Estate and one stop real estate information platform. We deliver our information through a range of formats, from Website and Social Platforms to conferences and electronic services. In this position, not only you can experience most fast-growing business but also data- & tech-driven online platform.

We are recruiting statistical assistant in New York team.

Location at Midtown Manhattan, New York.
Job Duty
The following job duties are including but not limited to ….

Assist in compute and analyze real estate and economic data by statistical/quantitative formula and model.

Maintain and enter a large dataset of real estate, economic data, and verify data integrity.

Compile reports, charts, or graphs that describe and interpret findings of analysis into the production of periodic research papers/documents.

Assist in participating in the publication of data or information and communicating with clients, policymakers, and media reporters.
No working experience is required

Must have at least Bachelor degree in Economics, Statistics, Math or other related fields.

Resume email to utofun@utofun.com
Location: New York City",1 to 50 Employees,Company - Private,Unknown / Non-Applicable,-1,-1,-1,37070,MNY,0,0,0,0,0,0,0,0,na,na,1221
Quantitative Researcher,TikTok,3.6,"About TikTok

Our mission is to inspire creativity and bring joy.
We have global offices including Los Angeles, New York, London, Paris, Berlin, Dubai, Mumbai, Singapore, Jakarta, Seoul, and Tokyo.

About the Role

TikTok is looking for a full-time Ads Data Scientist in our Global Business Solutions team within Marketing Science. This role will call for a quantitative thought leader with a specific focus on Individual Contribution of custom quantitive solutions and prototypes that help accelerate the work of our measurement, research, partnerships, or technical teams. Where your work drives high-performing insights, you will represent us at industry events, academic journals, or client conferences

What you will do

A successful candidate must have
TikTok is committed to creating an inclusive space where employees are valued for their skills, experiences, and unique perspectives. Our platform connects people from across the globe and so does our workplace. At TikTok, our mission is to inspire creativity and bring joy. To achieve that goal, we are committed to celebrating our diverse voices and to creating an environment that reflects the many communities we reach. We believe individuals shouldn't be disadvantaged because of their background or identity, but instead should be considered based on their strengths and experience.

TikTok is committed to providing reasonable accommodations during our recruitment process. If you need assistance or an accommodation, please reach out to us at accommodations@tiktok.com.",1001 to 5000 Employees,2016,Company - Private,Internet & Web Services,Information Technology,Unknown / Non-Applicable,129369,NY,0,0,0,0,0,0,0,0,na,na,1536
Junior AI/ML Software Developer,Paradyme Management,3.6,"Overview:
Paradyme Management is a rapidly growing government technology leader that puts service first, for its customers, its team and the communities it supports. Paradyme harnesses DevSecOps and Agile development processes to deliver exceptional results for digital transformations. With headquarters office in Tysons Corner, VA, Paradyme’s award-winning culture sets it apart through its team’s deep commitment to service and collaboration with its customers, each other and the community. Learn more at www.paradymemanagement.com.
Responsibilities:

Paradyme has partnered with an industry leader in enterprise Artificial Intelligence software and is seeking a talented Junior AI/ML Software Developer to help deliver solutions to our customers. Together we’re accelerating our client’s digital transformation through the building and deployment of data-driven, scalable AI solutions.

The Junior AI/ML Software Developer will work alongside a team of highly skilled engineers in the development of AI applications. A motivated and qualified candidate will not only have hands on development experience in (JavaScript, Python or Java) but also a willingness to collaborate with teams to solve problems.




EEO Statement:",51 to 200 Employees,2003,Company - Private,Information Technology Support Services,Information Technology,$10 to $25 million (USD),97401,DC,1,1,1,0,0,0,0,0,na,jr,1227
2022 Graduate Fellow Data Science Co-op,Merck,4.1,"Job Description
New hires in office-based roles in the US & Puerto Rico will be required, subject to applicable law, to demonstrate that they have been fully vaccinated for COVID-19 or qualify for a medical or religious exemption to this vaccination requirement that can be accommodated without an undue burden to the operation. However, subject to applicable law, employees working in roles that the Company determines require routine collaboration with external stakeholders, such as employees in customer facing commercial or research-based roles, will be required to be fully vaccinated as a condition of employment.
The Future Talent Program features Cooperative (Co-op) education that lasts up to 6 months and will include one or more projects. These opportunities in our Human Health Division. can provide you with great development and a chance to see if we are the right company for your long-term goals.



Intern/Co-op (Fixed Term)
Domestic
Yes
4",10000+ Employees,1891,Company - Public,Biotech & Pharmaceuticals,Pharmaceutical & Biotechnology,$10+ billion (USD),83375,PA,0,0,0,0,0,0,0,0,na,na,957
Junior Data Scientist,JCPenney,3.4,"Location: Plano, TX, United States -
Job ID: 1109493
Corporate Positions
Technology
Job Type: Full-Time
Date Updated: Jun 16, 2022
Junior Data Scientist

We are looking for Junior Data Scientist to join our growing Digital team focused on building transformational capabilities to support our 120-year-old brand. Under direct supervision of the Distinguished Data Scientist, this position will assist in data mining and optimization techniques to build and tune models to deliver long-term data science solutions.







We offer a competitive benefits package including medical/dental/vision, term life insurance, paid vacation/holidays, 401(k) Savings Plan with company match, and an associate discount on JCPenney merchandise.



JCPenney is the shopping destination for diverse, working American families. With inclusivity at its core, the Company's product assortment meets customers' everyday needs and helps them commemorate every special occasion with style, quality and value. JCPenney offers a broad portfolio of fashion, apparel, home, beauty and jewelry from national and private brands and provides personal services including salon, portrait and optical. The Company and its 50,000 associates worldwide serve customers where, when and how they want to shop - from jcp.com to more than 650 stores in the U.S. and Puerto Rico. In 2022, JCPenney celebrates 120 years as an iconic American brand by continuing its legacy of connecting with customers through shopping and community engagement. Please visit JCPenney's Newsroom to learn more and follow JCPenney on Facebook, Instagram, Twitter and LinkedIn.

For more opportunities to join our team please visit our careers page.",10000+ Employees,1902,Company - Private,"Department, Clothing & Shoe Stores",Retail & Wholesale,$1 to $2 billion (USD),77587,TX,0,0,0,0,0,0,0,0,data scientist,jr,1687
Data Analyst,Hulu,3.9,"We are seeking a Data Analyst who will focus on analyzing subscriber retention and engagement. Collaborating across marketing, product, data engineering, data science and business teams, this position will design and implement reporting that enables internal clients to access, explore and monitor data, as well as perform analysis and share underlying trends and insights to help teams have a better understanding of the ESPN+ and Disney+ subscribers, audience behavior and engagement drivers.
Responsibilities
Mine data, perform quantitative analysis and create clear and actionable narratives about our audience, their behaviors, and drivers of retention and engagement.
Partner with colleagues facilitating the design, build and automation of reports / dashboards that provide insight into customer conversion and behavior.
Build intuitive interfaces, infographics, and visualizations to tell stories with data.",1001 to 5000 Employees,2007,Company - Private,Broadcast Media,Media & Communication,$1 to $2 billion (USD),87765,CA,0,0,0,0,0,0,0,0,analyst,na,915
Quantitative Researcher,Bridgefront Capital,-1.0,"Quantitative Researchers work directly with our portfolio managers to innovate in our lab and manage production strategies. Our research team has excelled at multiple top firms and offers an opportunity to work with a strong successful group. Our technology enables rapid experimentation, flexibility in quantitative approaches, and large-scale hypothesis testing in a parallel computing environment. Our culture is collaborative and open with an emphasis on ingenuity and interrogating reality as we challenge assumptions and conduct rigorous research. Opportunities for advancement include overseeing a subset of strategies as a portfolio manager.

In this role you will:",1 to 50 Employees,Unknown,Unknown / Non-Applicable,-1,-1,-1,117321,TX,0,0,0,0,1,0,0,0,na,na,673
"Marketing Technology Data Engineer (Open to remote work, except the following locations: SD, VT, and WV)",Converse,4.1,"Become part of the Converse Team
Converse is a place to explore potential, break barriers and push out the edges of what can be. The company looks for people who can grow, think, dream and create. Its culture thrives by embracing diversity and rewarding imagination. The brand seeks achievers, leaders and visionaries. At Converse, it’s about each person bringing skills and passion to a challenging and constantly evolving world to make things better as a team.
We Need Someone Who Speaks Computer
Computers have their own language. Which most of us don’t speak. But you do. And we need your fluency. Let’s face it. The modern world is shackled to computers so we need experts like yourself to keep us running. So come join our crew. You don’t have to call yourself The Computer Whisperer but we might.",1001 to 5000 Employees,1908,Subsidiary or Business Segment,"Department, Clothing & Shoe Stores",Retail & Wholesale,$2 to $5 billion (USD),115000,MA,0,0,0,0,0,0,0,0,data engineer,na,803
data scientist (multiple openings) - Remote,Starbucks,3.8,"Job Posting
: Jun 23, 2022
Job Posting End Date
: Aug 23, 2022
Location
: US-WA-Seattle-Starbucks Support Center
Is this role eligible for remote or hybrid work? : Yes-Remote",10000+ Employees,1971,Company - Public,Restaurants & Cafes,Restaurants & Food Service,$10+ billion (USD),88607,WA,0,0,0,0,0,0,0,0,data scientist,na,174
Applied Machine Learning Scientist,Penguin Random House LLC,3.9,"Penguin Random House is the leading adult and children's publishing house in North America, the United Kingdom, and many other regions worldwide. In publishing the best books in every genre and subject for all ages, we are committed to quality, excellence in execution, and innovation throughout the entire publishing process: editorial, design, marketing, publicity, sales, production, and distribution. With the proliferation of data and the fast-changing dynamics within the publishing industry, data science and AI tools are vital to our business.

The Data Science team at Penguin Random House is seeking an Applied Machine Learning Scientist. We are an agile team of data scientists and software engineers. Data science at PRH truly runs the gamut, encompassing pricing systems, sales forecasting recommender/personalization systems, title segmentation, supply chain, ad-hoc analysis, and data exploration. The data science team is drawn from various disciplines and backgrounds; the group is well resourced and supported by data warehousing/engineering and DevOps functions.",1001 to 5000 Employees,2013,Company - Private,Publishing,Media & Communication,$1 to $2 billion (USD),89037,NY,0,0,0,0,1,0,0,0,mle,na,1081
Jr. Data Scientist,DonorSearch,3.9,"Background:
DonorSearch is the leading provider of prospect research solutions and AI-powered technologies, serving over 6,800 nonprofit organizations across the US. We are family-owned, headquartered in Maryland, and have a rapidly-growing remote workforce in every U.S. timezone. With our outstanding reputation and team of innovative professionals, we seek someone to join us to expand our brand and make a lasting impact on the world.
At DonorSearch, we value: Innovation, Excellence, Growth, Collaboration, and Quality.
Job Summary:
DonorSearch Aristotle introduced deep learning and machine learning into the nonprofit sector by building custom models with a robust interactive visualization tool to help organizations fundraise more efficiently. The Data Scientist will use best-in-class machine learning technologies to develop machine learning algorithms to meet various objectives of fundraising staff.",1 to 50 Employees,Company - Public,Accounting & Tax,Financial Services,Unknown / Non-Applicable,-1,60000,Remote,0,0,0,0,1,0,0,0,data scientist,jr,912
Graduate Data Scientist - Role Can be Remote,MARS,4.2,"The Petcare Segment consists of five Divisions: Pet Nutrition, Royal Canin, Mars Veterinary Health N. America, Mars Veterinary Health International & Diagnostics, Kinship. Under this new organization of Petcare Product and Service brands, we launched our Strategy in 2018 with an objective to “Create a Better World for Pets by extending global leadership in Nutrition, Health and Services powered by Data”.
With the breadth and scale of our Petcare businesses we have unique and unrivalled data assets. The potential to create benefits for Pets and sustainable competitive advantage is huge and we need to seize this opportunity now.
Our data assets consist of Veterinary data including appointment and invoice details as well as the medical histories and diagnostic details this provides. We have breed and disease marker data from our DNA diagnostics business (Wisdom Health), Location and Activity Tracking data from our Whistle business. From our nutrition businesses we have sales data, some consumer data as well as valuable information about retailers, Veterinarians, Breeders and Shelters. We also have third party data providing us with product purchasing insights and the potential to develop deeper and broader views into Petcare shopping through collaboration and D2C engagement.",10000+ Employees,1911,Company - Private,Food & Beverage Manufacturing,Manufacturing,$10+ billion (USD),97271,TN,0,0,0,0,0,0,0,0,data scientist,na,1292
Science Data Analyst for MAVEN/IUVS,University of Colorado Boulder,4.0,"Job Summary
Scientific Data Analyst for the Imaging UltraViolet Spectrograph team on the MAVEN mission orbiting Mars.


The University of Colorado Boulder is committed to building a culturally diverse community of faculty, staff, and students dedicated to contributing to an inclusive campus environment. We are an Equal Opportunity employer, including veterans and individuals with disabilities.
Who We Are
The Laboratory for Atmospheric and Space Physics (LASP) at the University of Colorado Boulder (CU) began in 1948, a decade before NASA. We are the world’s only academic research institute to have sent instruments to all eight planets and Pluto.",10000+ Employees,1876,College / University,Colleges & Universities,Education,$2 to $5 billion (USD),59543,CO,0,0,0,0,0,0,0,0,analyst,na,652
Junior Data Labeler,Deloitte,4.0,"Junior Data Labeler

In this age of disruption, organizations need to navigate the future with confidence by tapping into the power of data analytics, robotics, and cognitive technologies such as Artificial Intelligence (AI). Our Strategy & Analytics portfolio helps clients leverage rigorous analytical capabilities and a pragmatic mindset to solve the most complex of problems. By joining our team, you will play a key role in helping to our clients uncover hidden relationships from vast troves of data and transforming the Government and Public Services marketplace.

Work you'll do

The Junior Data Labeler will be focused on annotating tasks and delivering high quality results by following a variety of instructions.

The best candidate for this role will be:







Deloitte's Government and Public Services (GPS) practice - our people, ideas, technology and outcomes-is designed for impact. Serving federal, state, & local government clients as well as public higher education institutions, our team of over 15,000+ professionals brings fresh perspective to help clients anticipate disruption, reimagine the possible, and fulfill their mission promise.

The GPS Analytics and Cognitive (A&C) offering is responsible for developing advanced analytics products and applying data visualization and statistical programming tools to enterprise data in order to advance and enable the key mission outcomes for our clients. Our team supports all phases of analytic work product development, from the identification of key business questions through data collection and ETL, and from performing analyses and using a wide range of statistical, machine learning, and applied mathematical techniques to delivery insights to decision-makers. Our practitioners give special attention to the interplay between data and the business processes that produce it and the decision-makers that consume insights.",10000+ Employees,1850,Company - Private,Accounting & Tax,Financial Services,$10+ billion (USD),67245,VA,0,0,0,0,0,0,0,0,na,jr,1899
Applied Researcher,Microsoft,4.4,"Our team in Microsoft Azure AI is working on cutting-edge NLP and Deep Learning models to power Microsoft AI products and build it as a service to serve many internal and external applications. The team focuses on applying deep learning techniques to solve AI problems such as Natural Language to Code, efficient adaptation of large-scale language models, Question Answering on structured data, such as the No-code low-code AI models in Power Platform, the copilot project via the collaboration with Github, as well as applying large scale models such as GPT-3 & Dall-E 2, and reinforcement learning for various exciting products and AI service.

We are a hybrid team at the intersection of applied research and product, with positions ranging from researchers and applied scientists to software engineers. Our team has the flexibility to tackle challenging and exciting research problems that are highly related to product requirements. For this position, we are hiring for the NL and Code project for copilot project, or the no-code AI model project for Power Platform and other exciting NLAndCode and Safety projects to improve its model quality, as well as the large language model adaptation project and reinforcement learning to advance our research in this area.",10000+ Employees,1975,Company - Public,Computer Hardware Development,Information Technology,$10+ billion (USD),117794,WA,0,0,0,0,0,0,0,1,na,na,1269
"Staff Applied Scientist I, Recommendations & Personalization",Etsy,4.6,"Company Description

Etsy is the global marketplace for unique and creative goods. We build, power, and evolve the tools and technologies that connect entrepreneurs with buyers around the world. Etsy, Inc.'s 'house of brands' portfolio has expanded to now include four individually distinct ecommerce brands - Etsy, fashion resale marketplace Depop, musical instrument marketplace Reverb, and Brazil-based handmade goods marketplace Elo7. As an Etsy employee, you'll tackle unique problems alongside talented coworkers committed to Keeping Commerce Human. We're large enough that you'll focus on meaningful, complex challenges, but small enough that you can make a rewarding impact.

Job Description",1001 to 5000 Employees,2005,Company - Public,Other Retail Stores,Retail & Wholesale,$1 to $2 billion (USD),50449,NY,0,0,0,0,0,0,0,0,na,na,699
"Junior Researcher, Data Science",Paliwoda Group,-1.0,"Paliwoda Labs is looking for Junior Researchers to join our Data team: Students in Data Science who contribute to the work we do in large-scale data analysis and visualization, while enhancing their own academic skills and competencies within themes that suit their interests; and who may eventually move to technical or co-founder roles within our Ventures portfolio companies — projects they helped to grow.

Junior Researchers are assigned to projects in the Data Lab under the expert direct supervision of researchers already working with founders from the Ventures portfolio. Expect deep involvement in many aspects of each startup you are supporting to better understand business challenges, and to offer applicable technical solutions with a lean mindset that guides them through their growth and development.
Location: USA — New York City
Primary Responsibilities:





Paliwoda Labs is our incubator for bold experimentation and innovation, with a focus on practical applications that help startups attract investment capital. We partner with entrepreneurs to nurture their ideas at early stages; offering technical assistance to demonstrate initial viability, and mentorship to align the strategic vision of founders with paths toward monetization and profitability. The Data Lab practice provides a diverse range of expertise for crafting data-centric applications that create value in the ""real world"" through data analysis and visualization, and innovative storytelling.",-1,-1,-1,-1,-1,-1,50449,NY,0,0,0,0,0,0,0,0,na,jr,1483
